{
  "schema_version": "DISCOVERY_RESEARCH_CUT_V1",
  "status": "PUBLIC_SAFE_EXACT_HEAD_OBSERVATION_CUT",
  "inventory_binding": {
    "observed_date": "2026-09-21",
    "total_count": 58,
    "public_count": 23,
    "all_names_sha256": "c854d8891e87272f7bc1bb6530aedc339581a51a6be6026efb087c6be08e7a2d"
  },
  "observations": [
    {
      "repo": "Attune",
      "visibility": "PUBLIC",
      "observed_ref": "eff6f9eb250a6f7684459eadf0695340053201da",
      "source_locator": "thebrazenbeard/Attune:README.md@eff6f9eb250a6f7684459eadf0695340053201da",
      "evidence_state": "OBSERVED",
      "summary": "Relationship-first AI companion concept emphasizing persistent continuity, stable preferences and boundaries, mutuality, memory, and optional adult capability.",
      "mechanic_tags": [
        "RELATIONSHIP_CONTINUITY",
        "MEMORY",
        "BOUNDARIES",
        "PERSONA_STABILITY"
      ],
      "candidate_family_inputs": [
        "EMERGENT_RELATIONSHIP_AI"
      ],
      "boundaries": [
        "Relationship and identity semantics remain project-owned; reuse claims must not turn companion semantics into generic runtime authority."
      ],
      "uncertainties": [
        "README-level observation only; no claim is made here about implementation maturity or reusable mechanics."
      ],
      "promotion_ceiling": "OBSERVED_ONLY"
    },
    {
      "repo": "abil",
      "visibility": "PUBLIC",
      "observed_ref": "0812d9780ce1648820269fa142a43e17030ef793",
      "source_locator": "thebrazenbeard/abil:README.md@0812d9780ce1648820269fa142a43e17030ef793",
      "evidence_state": "OBSERVED",
      "summary": "Adaptive Brownfield Intelligence Layer research for learning existing industrial equipment, modeling behavior, exposing uncertainty, and eventually supporting explicitly bounded control actions.",
      "mechanic_tags": [
        "BROWNFIELD_SYSTEMS",
        "SYSTEM_IDENTIFICATION",
        "UNCERTAINTY",
        "SAFETY_GATES"
      ],
      "candidate_family_inputs": [
        "INDUSTRIAL_DIAGNOSTIC_CHAIN"
      ],
      "boundaries": [
        "Industrial meaning, safety qualification, and actuation authority remain ABIL-owned."
      ],
      "uncertainties": [
        "Repository states that production control code does not yet exist; reuse remains a research question."
      ],
      "promotion_ceiling": "OBSERVED_ONLY"
    },
    {
      "repo": "bt2",
      "visibility": "PUBLIC",
      "observed_ref": "30e81cadd94fae117a7f6875523c03251c7c9f6e",
      "source_locator": "thebrazenbeard/bt2:docs/migration/SOURCE_PROVENANCE_MANIFEST_V1.md@30e81cadd94fae117a7f6875523c03251c7c9f6e",
      "evidence_state": "OBSERVED",
      "summary": "Canonical Build Team Two platform repository whose initial 2026-09-10 tree was HC-derived; the unchanged Hyperconnectome root README is stale bootstrap residue rather than the best evidence of current repository role.",
      "mechanic_tags": [
        "CANONICAL_PLATFORM",
        "SOURCE_PROVENANCE",
        "MIGRATION",
        "LANTERN_RUNTIME",
        "HISTORICAL_BOOTSTRAP_RESIDUE"
      ],
      "candidate_family_inputs": [
        "EMERGENT_PLATFORM_CONSOLIDATION",
        "EVIDENCE_PROVENANCE_CUSTODY",
        "EXECUTION_INTEGRITY"
      ],
      "boundaries": [
        "HC-derived bootstrap content remains historical/source evidence and is not silently deleted or reclassified as disposable.",
        "Build Team Two platform authority and HC Brain cognitive-template semantics remain distinct despite shared historical source material."
      ],
      "uncertainties": [
        "Source history does not state why the HC-derived snapshot was selected as the initial bt2 seed.",
        "Whether HC-derived legacy files should remain, be archived, or be removed requires a separate dependency/provenance audit."
      ],
      "promotion_ceiling": "OBSERVED_ONLY"
    },
    {
      "repo": "discovery",
      "visibility": "PUBLIC",
      "observed_ref": "34b9d49ff4be7eedd6104cbfa5501549e468eccd",
      "source_locator": "thebrazenbeard/discovery:README.md@34b9d49ff4be7eedd6104cbfa5501549e468eccd",
      "evidence_state": "OBSERVED",
      "summary": "Portfolio architecture discovery system that tests whether repeated mechanisms should be shared or remain independently evolved.",
      "mechanic_tags": [
        "PORTFOLIO_CENSUS",
        "CLASSIFICATION",
        "HOSTILE_REVIEW",
        "REUSE_GOVERNANCE"
      ],
      "candidate_family_inputs": [
        "META_EVALUATION"
      ],
      "boundaries": [
        "Discovery records evidence about architecture but does not inherit authority from observed projects."
      ],
      "uncertainties": [
        "The pre-ingest README census is stale relative to the refreshed 2026-09-21 inventory and is being corrected in this branch."
      ],
      "promotion_ceiling": "OBSERVED_ONLY"
    },
    {
      "repo": "driftguard",
      "visibility": "PUBLIC",
      "observed_ref": "9894692ff6b549e4378bcc2b8ca46813ff18bf37",
      "source_locator": "thebrazenbeard/driftguard:README.md@9894692ff6b549e4378bcc2b8ca46813ff18bf37",
      "evidence_state": "OBSERVED",
      "summary": "Deterministic behavioral-drift monitor separating state binding, evidence evaluation, reload decisions, effects, acknowledgements, and later behavioral verification.",
      "mechanic_tags": [
        "EXACT_SUBJECT_BINDING",
        "EFFECT_RECONCILIATION",
        "MONOTONIC_LEDGER",
        "FAIL_CLOSED"
      ],
      "candidate_family_inputs": [
        "EXECUTION_INTEGRITY",
        "VERA_RUNTIME_CONTROL"
      ],
      "boundaries": [
        "Behavioral drift semantics and reload policy remain DriftGuard-owned even where effect mechanics overlap other systems."
      ],
      "uncertainties": [
        "Reusable effect-envelope mechanics are under separate Discovery experiments and are not promoted by this ingest."
      ],
      "promotion_ceiling": "OBSERVED_ONLY"
    },
    {
      "repo": "god-brain",
      "visibility": "PUBLIC",
      "observed_ref": "c0f6af7143aa5916bae96eb1f0ee9c9de6505cf5",
      "source_locator": "thebrazenbeard/god-brain:README.md@c0f6af7143aa5916bae96eb1f0ee9c9de6505cf5",
      "evidence_state": "OBSERVED",
      "summary": "Speculative research and engineering project integrating cognitive mechanisms into an evidence-disciplined architecture for higher-order world modeling, inference, memory, metacognition, and falsification.",
      "mechanic_tags": [
        "COGNITIVE_INTEGRATION",
        "WORLD_MODEL",
        "PROVENANCE",
        "FALSIFICATION"
      ],
      "candidate_family_inputs": [
        "COGNITIVE_BASE_OVERLAP",
        "EXPERIMENT_MECHANICS"
      ],
      "boundaries": [
        "Metaphysical hypotheses remain distinct from engineering evidence; integration does not establish simulation theory or deity contact."
      ],
      "uncertainties": [
        "The degree of implementation reuse versus conceptual aggregation requires exact tree-level analysis."
      ],
      "promotion_ceiling": "OBSERVED_ONLY"
    },
    {
      "repo": "hc-brain",
      "visibility": "PUBLIC",
      "observed_ref": "618245b54fb923c7a204892c6953ab6d1c5dac57",
      "source_locator": "thebrazenbeard/hc-brain:README.md@618245b54fb923c7a204892c6953ab6d1c5dac57",
      "evidence_state": "OBSERVED",
      "summary": "Reusable HC-series Hyperconnectome brain template defining a complete synthetic cognitive organ with subsystem, routing, memory, plasticity, and arbitration responsibilities.",
      "mechanic_tags": [
        "COGNITIVE_TEMPLATE",
        "HYPERCONNECTOME",
        "ROUTING",
        "MEMORY",
        "PLASTICITY"
      ],
      "candidate_family_inputs": [
        "COGNITIVE_BASE_OVERLAP"
      ],
      "boundaries": [
        "Identity-specific implementations are explicitly outside the base template."
      ],
      "uncertainties": [
        "Current reuse suitability must remain exact-subject-bound; prior Transcendence overlay experiments do not automatically qualify later heads."
      ],
      "promotion_ceiling": "OBSERVED_ONLY"
    },
    {
      "repo": "mosaic",
      "visibility": "PUBLIC",
      "observed_ref": "a3115031ec716526532b32dc004303b4042e4a26",
      "source_locator": "thebrazenbeard/mosaic:README.md@a3115031ec716526532b32dc004303b4042e4a26",
      "evidence_state": "OBSERVED",
      "summary": "Modular AI architecture research combining a persistent core with swappable specialist models while keeping draft architecture off canonical main until accepted.",
      "mechanic_tags": [
        "MODULAR_AI",
        "SPECIALIST_MODELS",
        "EXPERIMENT_GOVERNANCE"
      ],
      "candidate_family_inputs": [
        "EXPERIMENT_MECHANICS"
      ],
      "boundaries": [
        "Mosaic's architecture and evaluators remain project-specific unless a narrow mechanic independently earns reuse."
      ],
      "uncertainties": [
        "Canonical main is intentionally sparse; deeper current research lives on draft work surfaces not represented by this README-only cut."
      ],
      "promotion_ceiling": "OBSERVED_ONLY"
    },
    {
      "repo": "noema",
      "visibility": "PUBLIC",
      "observed_ref": "890efdca01cf496ce1b8686d86f8442a149a9d34",
      "source_locator": "thebrazenbeard/noema:README.md@890efdca01cf496ce1b8686d86f8442a149a9d34",
      "evidence_state": "OBSERVED",
      "summary": "Exploratory predictive cognitive architecture asking whether a persistent world-understanding system can be learned before language generation is introduced.",
      "mechanic_tags": [
        "PREDICTIVE_COGNITION",
        "WORLD_MODEL",
        "LEARNED_AGENCY"
      ],
      "candidate_family_inputs": [
        "EMERGENT_COGNITIVE_ARCHITECTURE"
      ],
      "boundaries": [
        "No current AI architecture is assumed to be core; architecture remains unresolved."
      ],
      "uncertainties": [